{
  "$schema": "https://json-schema.org/draft/2020-12/schema",
  "$id": "https://github.com/airomhq/airom/schemas/airom-v1.schema.json",
  "title": "AIROM native AIBOM (schema version 1)",
  "description": "The canonical, lossless AIROM AI Bill of Materials. This is the superset format every other output (CycloneDX, SARIF, YAML, table) projects from. Tri-state fields serialize as the value (Known), null (Unknown, applies-but-undetermined), or are omitted (Absent).",
  "type": "object",
  "required": ["schemaVersion", "tool", "serial", "timestamp", "source", "root", "components"],
  "additionalProperties": false,
  "properties": {
    "schemaVersion": { "const": "1" },
    "tool": {
      "type": "object",
      "required": ["name", "version"],
      "additionalProperties": false,
      "properties": {
        "name": { "type": "string" },
        "version": { "type": "string" },
        "commit": { "type": "string" },
        "rulesVersion": { "type": "string" },
        "rulesHash": { "type": "string" }
      }
    },
    "serial": { "type": "string", "pattern": "^urn:uuid:" },
    "timestamp": { "type": "string", "format": "date-time" },
    "lifecycle": { "enum": ["pre-build", "post-build", ""] },
    "source": { "$ref": "#/$defs/source" },
    "root": { "$ref": "#/$defs/id" },
    "components": { "type": "array", "items": { "$ref": "#/$defs/component" } },
    "relationships": { "type": "array", "items": { "$ref": "#/$defs/relationship" } },
    "unknowns": { "type": "array", "items": { "$ref": "#/$defs/unknown" } },
    "compliance": { "type": "array", "items": { "$ref": "#/$defs/complianceResult" } },
    "stats": { "type": "object" }
  },
  "$defs": {
    "id": { "type": "string", "pattern": "^airom:[0-9a-f]{16}$" },
    "complianceResult": {
      "type": "object",
      "additionalProperties": false,
      "required": ["framework", "name", "version", "controls"],
      "properties": {
        "framework": { "type": "string" },
        "name": { "type": "string" },
        "version": { "type": "string" },
        "url": { "type": "string" },
        "controls": { "type": "array", "items": { "$ref": "#/$defs/controlOutcome" } }
      }
    },
    "controlOutcome": {
      "type": "object",
      "additionalProperties": false,
      "required": ["id", "title", "state", "rationale"],
      "properties": {
        "id": { "type": "string" },
        "title": { "type": "string" },
        "text": { "type": "string" },
        "ref": { "type": "string" },
        "state": { "enum": ["met", "gap", "manual"] },
        "score": { "type": "number", "minimum": 0, "maximum": 1 },
        "rationale": { "type": "string" },
        "evidence": { "type": "array", "items": { "$ref": "#/$defs/id" } },
        "counterEvidence": { "type": "array", "items": { "$ref": "#/$defs/id" } }
      }
    },
    "optString": { "type": ["string", "null"] },
    "optInt64": { "type": ["integer", "null"] },
    "optTime": { "type": ["string", "null"], "format": "date-time" },
    "triState": { "enum": ["yes", "no", "unknown"] },
    "componentKind": {
      "enum": [
        "hosted-llm", "local-model-file", "embedding-model", "framework",
        "library", "vector-db", "prompt", "dataset", "ai-config", "infra",
        "service", "rag-pipeline", "application"
      ]
    },
    "detectionMethod": {
      "enum": [
        "source-code-analysis", "ast-fingerprint", "manifest-analysis",
        "binary-analysis", "hash-comparison", "config-analysis", "filename",
        "attestation"
      ]
    },
    "relType": {
      "enum": [
        "uses", "depends-on", "served-by", "queries", "embeds-with",
        "prompted-by", "trained-on", "derived-from", "configures", "contains"
      ]
    },
    "confidence": { "type": "number", "minimum": 0, "maximum": 1 },
    "source": {
      "type": "object",
      "required": ["kind", "target"],
      "properties": {
        "kind": { "enum": ["dir", "repo", "image", "k8s"] },
        "target": { "type": "string" },
        "imageDigest": { "type": "string" },
        "git": {
          "type": "object",
          "properties": {
            "remote": { "type": "string" },
            "commit": { "type": "string" },
            "branch": { "type": "string" },
            "dirty": { "type": "boolean" }
          }
        },
        "k8s": { "type": "object" }
      }
    },
    "hash": {
      "type": "object",
      "required": ["alg", "hex"],
      "properties": { "alg": { "type": "string" }, "hex": { "type": "string" } }
    },
    "kv": {
      "type": "object",
      "required": ["name", "value"],
      "properties": {
        "name": { "type": "string", "pattern": "^airom:" },
        "value": { "type": "string" }
      }
    },
    "location": {
      "type": "object",
      "required": ["path"],
      "properties": {
        "path": { "type": "string" },
        "line": { "type": "integer", "minimum": 0 },
        "endLine": { "type": "integer", "minimum": 0 },
        "column": { "type": "integer", "minimum": 0 },
        "endColumn": { "type": "integer", "minimum": 0 },
        "layer": { "type": "string" }
      }
    },
    "occurrence": {
      "type": "object",
      "required": ["location", "detectorId", "method", "confidence"],
      "properties": {
        "location": { "$ref": "#/$defs/location" },
        "detectorId": { "type": "string" },
        "method": { "$ref": "#/$defs/detectionMethod" },
        "confidence": { "$ref": "#/$defs/confidence" },
        "snippet": { "type": "string" },
        "symbol": { "type": "string" },
        "fields": { "type": "object", "additionalProperties": { "type": "string" } }
      }
    },
    "identityClaim": {
      "type": "object",
      "required": ["field", "value", "confidence"],
      "properties": {
        "field": { "enum": ["name", "version", "purl", "hash"] },
        "value": { "type": "string" },
        "confidence": { "$ref": "#/$defs/confidence" },
        "methods": { "type": "array", "items": { "$ref": "#/$defs/detectionMethod" } }
      }
    },
    "component": {
      "type": "object",
      "required": ["id", "kind", "name", "confidence", "evidence"],
      "properties": {
        "id": { "$ref": "#/$defs/id" },
        "kind": { "$ref": "#/$defs/componentKind" },
        "name": { "type": "string" },
        "group": { "type": "string" },
        "version": { "$ref": "#/$defs/optString" },
        "provider": { "$ref": "#/$defs/optString" },
        "purl": { "type": "string" },
        "licenses": { "type": "array" },
        "supplier": { "type": "object" },
        "hashes": { "type": "array", "items": { "$ref": "#/$defs/hash" } },
        "downloadLocation": { "$ref": "#/$defs/optString" },
        "sourceInfo": { "type": "string" },
        "releaseTime": { "$ref": "#/$defs/optTime" },
        "model": { "type": "object" },
        "data": { "type": "object" },
        "infra": { "type": "object" },
        "package": { "type": "object" },
        "confidence": { "$ref": "#/$defs/confidence" },
        "evidence": {
          "type": "object",
          "properties": {
            "occurrences": { "type": "array", "items": { "$ref": "#/$defs/occurrence" } },
            "identity": { "type": "array", "items": { "$ref": "#/$defs/identityClaim" } }
          }
        },
        "testOnly": { "type": "boolean" },
        "props": { "type": "array", "items": { "$ref": "#/$defs/kv" } },
        "attestations": { "type": "array" },
        "risks": { "type": "array", "items": { "$ref": "#/$defs/artifactRisk" } },
        "vulnerabilities": { "type": "array", "items": { "$ref": "#/$defs/vulnerability" } },
        "eol": { "$ref": "#/$defs/eol" }
      }
    },
    "artifactRisk": {
      "type": "object",
      "required": ["id", "severity"],
      "properties": {
        "id": { "type": "string" },
        "severity": { "enum": ["high", "medium", "low"] },
        "detail": { "type": "array", "items": { "type": "string" } },
        "occurrence": { "$ref": "#/$defs/occurrence" }
      }
    },
    "vulnerability": {
      "type": "object",
      "required": ["id", "severity", "source"],
      "properties": {
        "id": { "type": "string" },
        "aliases": { "type": "array", "items": { "type": "string" } },
        "severity": { "enum": ["critical", "high", "medium", "low", "unknown"] },
        "score": { "type": "number", "minimum": 0, "maximum": 10 },
        "vector": { "type": "string" },
        "summary": { "type": "string" },
        "fixedVersion": { "type": "string" },
        "source": { "type": "string" },
        "url": { "type": "string" }
      }
    },
    "eol": {
      "type": "object",
      "required": ["state", "source"],
      "properties": {
        "state": { "enum": ["supported", "deprecated", "retired", "unknown"] },
        "announced": { "type": "string", "format": "date" },
        "shutdown": { "type": "string", "format": "date" },
        "daysRemaining": { "type": "integer" },
        "replacement": { "type": "string" },
        "replacementState": { "enum": ["supported", "deprecated", "retired", "unknown"] },
        "source": { "type": "string" },
        "sourceUrl": { "type": "string" },
        "verified": { "type": "string", "format": "date" }
      }
    },
    "relationship": {
      "type": "object",
      "required": ["from", "to", "type", "confidence"],
      "properties": {
        "from": { "$ref": "#/$defs/id" },
        "to": { "$ref": "#/$defs/id" },
        "type": { "$ref": "#/$defs/relType" },
        "confidence": { "$ref": "#/$defs/confidence" },
        "evidence": { "type": "array", "items": { "$ref": "#/$defs/occurrence" } }
      }
    },
    "unknown": {
      "type": "object",
      "required": ["path", "detectorId", "reason"],
      "properties": {
        "path": { "type": "string" },
        "detectorId": { "type": "string" },
        "reason": { "type": "string" }
      }
    }
  }
}
