{
  "schemaVersion": "1",
  "tool": {
    "name": "airom",
    "version": "1.0.0",
    "commit": "abc123",
    "rulesVersion": "builtin",
    "rulesHash": "0123456789abcdef0123456789abcdef0123456789abcdef0123456789abcdef"
  },
  "serial": "urn:uuid:00000000-0000-4000-8000-000000000000",
  "timestamp": "2026-07-17T12:00:00Z",
  "lifecycle": "pre-build",
  "source": {
    "kind": "dir",
    "target": "/src/ai-app",
    "git": {
      "remote": "https://github.com/acme/ai-app.git",
      "commit": "deadbeef"
    }
  },
  "root": "airom:0000000000000000",
  "components": [
    {
      "id": "airom:0000000000000000",
      "kind": "application",
      "name": "ai-app",
      "confidence": 1,
      "evidence": {}
    },
    {
      "id": "airom:1111111111111111",
      "kind": "hosted-llm",
      "name": "gpt-4.1",
      "provider": "openai",
      "model": {
        "task": "text-generation",
        "architecture": null
      },
      "confidence": 0.8738,
      "evidence": {
        "occurrences": [
          {
            "location": {
              "path": "src/rag.py",
              "line": 7,
              "endLine": 7,
              "column": 5,
              "endColumn": 20
            },
            "detectorId": "rules/openai/model-literal",
            "method": "source-code-analysis",
            "confidence": 0.85,
            "snippet": "model = \"gpt-4.1\""
          },
          {
            "location": {
              "path": "src/rag.py",
              "line": 8,
              "endLine": 8,
              "column": 5,
              "endColumn": 20
            },
            "detectorId": "rules/openai/chat-call",
            "method": "config-analysis",
            "confidence": 0.7,
            "snippet": "model = \"gpt-4.1\""
          }
        ],
        "identity": [
          {
            "field": "name",
            "value": "gpt-4.1",
            "confidence": 0.85,
            "methods": [
              "source-code-analysis"
            ]
          }
        ]
      },
      "props": [
        {
          "name": "airom:model.provider",
          "value": "openai"
        },
        {
          "name": "airom:model.id",
          "value": "gpt-4.1"
        },
        {
          "name": "airom:param.temperature",
          "value": "0.2 @ src/rag.py:8"
        }
      ],
      "eol": {
        "state": "deprecated",
        "announced": "2026-04-22",
        "shutdown": "2026-10-23",
        "daysRemaining": 98,
        "replacement": "gpt-4.2",
        "replacementState": "deprecated",
        "source": "airom-catalog",
        "sourceUrl": "https://example.com/deprecations",
        "verified": "2026-07-17"
      }
    },
    {
      "id": "airom:2222222222222222",
      "kind": "local-model-file",
      "name": "tiny.gguf",
      "provider": "local",
      "purl": "pkg:generic/tiny.gguf?checksum=sha256:abababababababababababababababababababababababababababababababab",
      "hashes": [
        {
          "alg": "SHA-256",
          "hex": "abababababababababababababababababababababababababababababababab"
        }
      ],
      "model": {
        "format": "gguf"
      },
      "confidence": 1,
      "evidence": {
        "occurrences": [
          {
            "location": {
              "path": "models/tiny.gguf"
            },
            "detectorId": "modelfile/gguf",
            "method": "hash-comparison",
            "confidence": 1
          }
        ]
      },
      "risks": [
        {
          "id": "AIROM-RISK-PICKLE-IMPORT",
          "severity": "high",
          "detail": [
            "os.system"
          ],
          "occurrence": {
            "location": {
              "path": "models/tiny.gguf"
            },
            "detectorId": "modelfilex/torch",
            "method": "binary-analysis",
            "confidence": 0.95
          }
        }
      ]
    },
    {
      "id": "airom:3333333333333333",
      "kind": "framework",
      "name": "langchain",
      "version": "0.2.1",
      "purl": "pkg:pypi/langchain@0.2.1",
      "package": {
        "ecosystem": "pypi"
      },
      "confidence": 0.985,
      "evidence": {
        "occurrences": [
          {
            "location": {
              "path": "requirements.txt",
              "line": 1
            },
            "detectorId": "manifest/pypi-requirements",
            "method": "manifest-analysis",
            "confidence": 0.95
          }
        ]
      },
      "vulnerabilities": [
        {
          "id": "CVE-2024-0001",
          "aliases": [
            "GHSA-aaaa-bbbb-cccc"
          ],
          "severity": "high",
          "score": 7.5,
          "vector": "CVSS:3.1/AV:N/AC:L/PR:N/UI:N/S:U/C:H/I:N/A:N",
          "summary": "Server-side request forgery in the example loader.",
          "fixedVersion": "0.2.5",
          "source": "osv.dev",
          "url": "https://osv.dev/vulnerability/CVE-2024-0001"
        }
      ]
    },
    {
      "id": "airom:4444444444444444",
      "kind": "dataset",
      "name": "squad",
      "data": {
        "format": "jsonl",
        "sizeBytes": 2048
      },
      "confidence": 0.7,
      "evidence": {
        "occurrences": [
          {
            "location": {
              "path": "testdata/squad.jsonl"
            },
            "detectorId": "dataset/file",
            "method": "filename",
            "confidence": 0.7
          }
        ]
      },
      "testOnly": true
    },
    {
      "id": "airom:5555555555555555",
      "kind": "vector-db",
      "name": "chroma",
      "confidence": 0.7,
      "evidence": {
        "occurrences": [
          {
            "location": {
              "path": "src/rag.py",
              "line": 12
            },
            "detectorId": "rules/chroma/client",
            "method": "source-code-analysis",
            "confidence": 0.7
          }
        ]
      }
    }
  ],
  "relationships": [
    {
      "from": "airom:0000000000000000",
      "to": "airom:3333333333333333",
      "type": "depends-on",
      "confidence": 0.95
    },
    {
      "from": "airom:1111111111111111",
      "to": "airom:4444444444444444",
      "type": "trained-on",
      "confidence": 0.8
    },
    {
      "from": "airom:5555555555555555",
      "to": "airom:1111111111111111",
      "type": "queries",
      "confidence": 0.6,
      "evidence": [
        {
          "location": {
            "path": "src/rag.py",
            "line": 12
          },
          "detectorId": "rules/chroma/client",
          "method": "source-code-analysis",
          "confidence": 0.6
        }
      ]
    }
  ],
  "unknowns": [
    {
      "path": "models/corrupt.safetensors",
      "detectorId": "modelfile/safetensors",
      "reason": "header length exceeds file"
    }
  ],
  "compliance": [
    {
      "framework": "nist-ai-rmf",
      "name": "NIST AI Risk Management Framework",
      "version": "1.0",
      "url": "https://www.nist.gov/itl/ai-risk-management-framework",
      "controls": [
        {
          "id": "MAP-2.1",
          "title": "AI methods are inventoried and documented",
          "ref": "https://airc.nist.gov/",
          "state": "met",
          "score": 1,
          "rationale": "2 component(s) provide supporting evidence",
          "evidence": [
            "airom:1111111111111111",
            "airom:3333333333333333"
          ]
        },
        {
          "id": "MEASURE-2.7",
          "title": "AI system security and resilience are evaluated",
          "state": "gap",
          "score": 0,
          "rationale": "1 component(s) constitute a gap",
          "counterEvidence": [
            "airom:2222222222222222"
          ]
        },
        {
          "id": "GOVERN-1.1",
          "title": "Legal and regulatory requirements are documented",
          "state": "manual",
          "rationale": "not automatable by a static scan — requires manual attestation"
        }
      ]
    }
  ],
  "stats": {
    "filesWalked": 0,
    "filesProcessed": 0,
    "filesFailed": 0,
    "headerBytes": 0,
    "contentBytes": 0,
    "durationNs": 0
  }
}
